{
  "$schema": "../_schemas/01-identity.schema.json",
  "version": "1.0",
  "stage": "identity",
  "exam_id": "pl-b1",

  "identity_data": {
    "confirmed_title": "Egzamin Certyfikatowy z Języka Polskiego jako Obcego - B1",
    "confirmed_provider": "Państwowa Komisja ds. Poświadczania Znajomości Języka Polskiego jako Obcego",
    "confirmed_level": "B1",
    "family": "Polish State Certificate",
    "language_code": "pl",
    "exam_format": "paper-based",
    "official_url": "https://certyfikatpolski.pl/",
    "exam_duration_total_min": 190,
    "sections_count": 5
  },

  "confidence": {
    "overall": 0.95,
    "title_match": 0.98,
    "provider_match": 0.92,
    "level_match": 1.0
  },

  "sources": [
    {
      "url": "https://certyfikatpolski.pl/o-egzaminie/",
      "title": "O egzaminie - Certyfikat Polski",
      "trust": "high",
      "type": "official"
    },
    {
      "url": "https://certyfikatpolski.pl/informator/",
      "title": "Informator dla zdających",
      "trust": "high",
      "type": "official"
    }
  ],

  "verification_method": "iterative_web_search",
  "iterations_count": 2,

  "_comparison_hints": {
    "critical_fields": [
      "identity_data.confirmed_level",
      "identity_data.family",
      "identity_data.language_code",
      "identity_data.sections_count"
    ],
    "flexible_fields": [
      "identity_data.confirmed_title",
      "identity_data.confirmed_provider",
      "confidence.overall"
    ],
    "ignore_fields": [
      "sources",
      "verification_method",
      "iterations_count"
    ]
  },

  "_notes": "Identity stage должен правильно определить семейство экзамена (Polish State Certificate), уровень (B1), язык (pl) и количество секций (5)."
}
